,DateTime,Tweet_Id,Tweet,User_Id,Retweet,Location,Label,Country
319,2021-10-28 13:12:25,1453711251889000449,now we need dear sputnik and ice cream music video chenes TXT Frost,1083198663424237569,0,"Manila City, Philippines",Neutral,
320,2021-10-28 13:10:44,1453710828117663746,Well you already get sputnik whatever effect it could have have would have already happen by now i think,746059169212563456,0,she/her | 25,Neutral,
321,2021-10-28 13:10:34,1453710784354308097,China s hypersonic missile test close to Sputnik moment say US general,765511120723468288,1,,Weakly_Positive,
322,2021-10-28 13:09:47,1453710589684064270,Top U S military officer say China s hypersonic weapon test very close to a Sputnik moment,2467791,119,,Weakly_Positive,
323,2021-10-28 13:09:39,1453710554061811714,agree,418731185,0,اليمن,Neutral,
324,2021-10-26 18:48:05,1453070949788659715,If you re so worried about child suffer long covid why aren t they,1310602613453447170,0,,Highly_Negative,
325,2021-10-25 12:31:22,1452613754743627788,trilc be the fake news Is the fake covid vaadine new,1451204083923267584,0,İzmir,Highly_Negative,
326,2021-10-24 16:57:46,1452318410856140819,And so must be the case with SputnikLight SputnikV,81334244,0,,Neutral,
327,2021-10-22 10:11:20,1451491354475855878,70 day still leave till 31 dec for GOI commitment They need 1 25 Cr per day to Achieve it For,1951793504,1,"Mumbai, India",Neutral,
328,2021-10-22 08:58:13,1451472953850224646,70 day still leave till 31 dec for GOI commitment They need 1 25 Cr per day to Achieve i,1146414307455881218,1,India,Neutral,
329,2021-10-22 07:44:09,1451454312589283329,Exactly which be why the booster need to be of a different nature like SputnikV or,150652934,0,,Weakly_Positive,
330,2021-10-21 14:23:44,1451192484655034379,Big pharma vaccine efficacy be fail Why aren t the elderly and public bein,111556423,0,,Highly_Negative,
331,2021-10-21 12:48:34,1451168531933024261,Instead of attack SputnikV we urge Western mRNA vaccine producer to consider use the one component SputnikLight a,1120732637298077702,1,,Neutral,
332,2021-10-21 10:14:14,1451129693671804931,Congratulations The individual who take the 1 Billionth dose today need to be fec,432697203,0,India,Neutral,
333,2021-10-20 13:49:16,1450821419961618438,And what a coincidence WHO and EU do not approval sputnik V amp SputnikLight WTF,1293113010941296640,0,"لاہور, پاکستان",Weakly_Negative,
